{
  "task_source": "github",
  "test_commands": [
    ["git", "diff", "--check"]
  ],
  "slow_test_commands": [],
  "max_retries": 3,
  "max_files": null,
  "test_timeout_seconds": 300,
  "task_timeout_seconds": 1800,
  "security_mode": "trusted",
  "permission_policy": {
    "developer": {"read_files": true, "search_files": true, "edit_files": true, "create_files": true, "git_read": true, "run_checks": true, "network": false, "allow_dangerous": false},
    "reviewer": {"read_files": true, "search_files": true, "git_read": true, "network": false}
  },
  "sandbox": {
    "enabled": false,
    "engine": "docker",
    "image": "agentic-runner:latest",
    "allow_network": false
  },
  "developer": {
    "provider": "gemini",
    "model": null,
    "reasoning_effort": null,
    "timeout_seconds": 600
  },
  "reviewer": {
    "provider": "gemini",
    "model": null,
    "reasoning_effort": null,
    "timeout_seconds": 300
  }
}
