{
  "task_source": "github",
  "test_commands": [
    ["git", "diff", "--check"]
  ],
  "slow_test_commands": [],
  "max_retries": 3,
  "max_files": null,
  "test_timeout_seconds": 300,
  "task_timeout_seconds": 1800,
  "developer": {
    "provider": "codex",
    "model": null,
    "reasoning_effort": null,
    "timeout_seconds": 600
  },
  "reviewer": {
    "provider": "codex",
    "model": null,
    "reasoning_effort": null,
    "timeout_seconds": 300
  }
}
