{
  "task_source": "github",
  "test_commands": [
    ["python", "-m", "unittest", "discover", "-s", "tests", "-q"]
  ],
  "slow_test_commands": [],
  "max_retries": 3,
  "max_files": null,
  "test_timeout_seconds": null,
  "task_timeout_seconds": 1800,
  "sandbox": {
    "enabled": false,
    "engine": "docker",
    "image": "agentic-runner:latest",
    "allow_network": false
  },
  "developer": {
    "provider": "codex",
    "model": null,
    "reasoning_effort": null,
    "timeout_seconds": null
  },
  "reviewer": {
    "provider": "codex",
    "model": null,
    "reasoning_effort": null,
    "timeout_seconds": null
  }
}
